{
  "schema_version": "ai-experiments.semantic-ir.break-even-comparison/v0",
  "observation_id": "semantic-ir-construction/break-even-001",
  "purpose": "construction_observation",
  "model_calls_authorized": true,
  "efficacy_claim_authorized": false,
  "adaptive_stopping": false,
  "task_family": {
    "family_id": "repeated-user-lookup-bodies-v0",
    "source_unit": "typescript_function_body",
    "compact_unit": "compact_program_tree",
    "shared_abi": "compiler_supplied_function_headers"
  },
  "sizes": [1, 2, 4, 8, 16],
  "execution_order": [
    {"size": 1, "arms": ["source", "compact_ir"]},
    {"size": 2, "arms": ["compact_ir", "source"]},
    {"size": 4, "arms": ["source", "compact_ir"]},
    {"size": 8, "arms": ["compact_ir", "source"]},
    {"size": 16, "arms": ["source", "compact_ir"]}
  ],
  "artifacts": {
    "compact_decoder_path": "scripts/compact_ir.py",
    "compact_decoder_sha256": "9e07f5a758f01fb2fa836b887027193bbe3671f9deb2c8e8f05a89b2b9ab3429",
    "semantic_lowerer_path": "scripts/semantic_ir.py",
    "semantic_lowerer_sha256": "1ab428bfddcd86c1deb9b788119d7f6e7bbdb817c733de46626986735b41ba5d",
    "catalog_path": "construction/task-001-user-lookup/participant-context/catalog.json",
    "catalog_sha256": "e162125a1cb3a7fe9b4bbdf63d0ee1f455ba71faaa2a367b98d124e74aec6ffa",
    "common_prompts": [
      {"size": 1, "bytes": 3267, "sha256": "0d11ba8913b5ff3e1b000a28cabc1e7040025b44214d76612ffced8a4b22ae17"},
      {"size": 2, "bytes": 3485, "sha256": "b44c4a4a8a57e0337bd35bee0515cba2cd37a5de7870a94ad71a5e3619eaaae0"},
      {"size": 4, "bytes": 3921, "sha256": "2a1fb33cae59d5b2e6804dbb062246dbafd070757092b22ea49d9467c00266f7"},
      {"size": 8, "bytes": 4793, "sha256": "615d0d733be692f1ee3e3ec48f7834936e440fe6f99b84949317af7fbe6f4ef2"},
      {"size": 16, "bytes": 6545, "sha256": "296c5701dd2b2bd279387854f52cd4d468408c92b8a875c4108441b051f10f39"}
    ]
  },
  "model_sources": {
    "model_lock_path": "experiments/coding-agents/local-first-routing/2026-07-30/model-lock.json",
    "model_lock_sha256": "b4147d513b82837a6a21b3f649cfe4ef3968f80c18ce69920dcbdeceafcaef31",
    "hosted_treatment_path": "experiments/coding-agents/local-first-routing/2026-07-30/calibration/hosted-treatment.json",
    "hosted_treatment_sha256": "aba89d9cc41c24d31423ebd9199c080a7cbd641eabda25644ffe9b19468de413"
  },
  "model": {
    "provider": "Amazon Bedrock",
    "provider_model": "us.anthropic.claude-sonnet-4-6",
    "foundation_model": "anthropic.claude-sonnet-4-6",
    "api_format": "bedrock-converse",
    "region": "us-east-1",
    "identity_policy": "endpoint_locked_model_and_iam_scope"
  },
  "sampling": {"temperature": 0, "maximum_output_tokens": 8192},
  "limits": {
    "provider_requests_per_cell": 1,
    "submission_attempts_per_cell": 1,
    "inference_timeout_seconds": 300,
    "maximum_cells": 10
  },
  "accounting": {
    "source": "provider_native",
    "input_metric": "usage_inputTokens",
    "cached_input_metric": "usage_cacheReadInputTokens",
    "output_metric": "usage_outputTokens",
    "input_usd_per_million_tokens": 3.0,
    "cached_input_usd_per_million_tokens": 0.3,
    "output_usd_per_million_tokens": 15.0
  },
  "initial_user_message": "Produce the complete ordered submission by calling the required tool exactly once. Do not answer in plain text."
}
